question,answer,contexts,reference
"What is the estimated cost of a simple imaging procedure such as scanning a suspicious abdominal mass or a suspected abdominal aortic aneurysm, depending on the quality of the equipment and other factors?","The estimated cost of a simple imaging procedure such as scanning a suspicious abdominal mass or a suspected abdominal aortic aneurysm can be a few hundred dollars or more, depending on the quality of the equipment. The actual cost may vary due to factors like operator expertise and other considerations. This makes it difficult to provide an exact figure without further information.","['makes it difficult to generalize about the time and costs\ninvolved. Relatively simple imaging—scanning a suspi-\ncious abdominal mass or a suspected abdominal aortic\naneurysm—will take about half an hour to perform and\nwill cost a few hundred dollars or more, depending on\nthe quality of the equipment, the operator and other fac-\ntors. More involved techniques such as multiple M-mode\nand Doppler-enhanced scans, or cases where the targets\nnot well defined in advance, generally take more time'
 'not well defined in advance, generally take more time\nand are more expensive.\nRegardless of the type of scan used and the potential\ndifficulties encountered, ultrasound remains faster and\nless expensive than computed tomography scans (CT),\nits primary rival in abdominal imaging. Furthermore, as\nabdominal ultrasounds are generally undertaken as\n“medically necessary” procedures designed to detect the\npresence of suspected abnormalities, they are covered\nGALE ENCYCLOPEDIA OF MEDICINE 24'
 'inal aorta and the portal vein of the liver. These\nmachines cost about $250,000.\nThe actual procedure for a patient undergoing an\nabdominal ultrasound is relatively simple, regardless of\nthe type of scan or its purpose. Fasting for at least eight\nhours prior to the procedure ensures that the stomach is\nempty and as small as possible, and that the intestines\nand bowels are relatively inactive. Fasting also allows the\ngall bladder to be seen, as it contracts after eating and'
 'initial scan when abdominal trauma is suspected, and it\ncan be used to pinpoint the location, cause, and severity\nof hemorrhaging. In the case of puncture wounds,f r o m\na bullet for example, ultrasound can locate the foreign\nobject and provide a preliminary survey of the damage.\nThe easy portability and versatility of ultrasound tech-\nnology has brought it into common emergency room\nuse, and even into limited ambulance service.\n• Abdominal mass. Abnormal growths—tumors, cysts,'
 'This procedure is conducted by a doctor with the\nassistance of a technologist skilled in operating the\nequipment. The probe is moved around the abdomen to\nobtain different views of the target areas. The patient will\nlikely be asked to change positions from side to side and\nto hold their breath as necessary to obtain the desired\nviews. Discomfort during the procedure is minimal.\nThe many types and uses of ultrasound technology\nmakes it difficult to generalize about the time and costs']",A few hundred dollars or more
"What is the primary advantage of ultrasound scans over computed tomography (CT) scans in abdominal imaging, according to the text?","Ultrasound scans are generally faster and less expensive than computed tomography (CT) scans in abdominal imaging. This is according to the text, which states that ultrasound remains ""faster and less expensive"" than CT scans. Ultrasound also has other advantages over CT scans, such as not using ionizing radiation.","['not well defined in advance, generally take more time\nand are more expensive.\nRegardless of the type of scan used and the potential\ndifficulties encountered, ultrasound remains faster and\nless expensive than computed tomography scans (CT),\nits primary rival in abdominal imaging. Furthermore, as\nabdominal ultrasounds are generally undertaken as\n“medically necessary” procedures designed to detect the\npresence of suspected abnormalities, they are covered\nGALE ENCYCLOPEDIA OF MEDICINE 24'
 'radiation. Ultrasound is also generally far better than\nplain x rays at distinguishing the subtle variations of soft\ntissue structures, and can be used in any of several\nmodes, depending on the need at hand.\nAs an imaging tool, abdominal ultrasound generally\nis warranted for patients afflicted with: chronic or acute\nabdominal pain; abdominal trauma; an obvious or sus-\npected abdominal mass; symptoms of liver disease, pan-\ncreatic disease, gallstones , spleen disease, kidney dis-'
 'tion, and interpretation of ultrasound continue. Its low\ncost, versatility, safety and speed have brought it into the\ntop drawer of medical imaging techniques.\nWhile pelvic ultrasound is widely known and com-\nmonly used for fetal monitoring during pregnancy ,\nultrasound is also routinely used for general abdominal\nimaging. It has great advantage over x-ray imaging tech-\nnologies in that it does not damage tissues with ionizing\nradiation. Ultrasound is also generally far better than'
 'Higher frequency ultrasound waves produce more\ndetailed images, but are also more readily absorbed and\nso cannot penetrate as deeply into the body. Abdominal\nultrasound imaging is generally performed at frequencies\nbetween 2-5 MHz.\nAn ultrasound machine consists of two parts: the\ntransducer and the analyzer. The transducer both produces\nthe sound waves that penetrate the body and receives the\nreflected echoes. Transducers are built around piezoelec-'
 'initial scan when abdominal trauma is suspected, and it\ncan be used to pinpoint the location, cause, and severity\nof hemorrhaging. In the case of puncture wounds,f r o m\na bullet for example, ultrasound can locate the foreign\nobject and provide a preliminary survey of the damage.\nThe easy portability and versatility of ultrasound tech-\nnology has brought it into common emergency room\nuse, and even into limited ambulance service.\n• Abdominal mass. Abnormal growths—tumors, cysts,']",Ultrasound scans are faster and less expensive than computed tomography (CT) scans in abdominal imaging.
"What are the common uses of abdominal ultrasound in clinical practice, according to GALE ENCYCLOPEDIA OF MEDICINE 24?","Abdominal ultrasound is commonly used in clinical practice to diagnose patients with chronic or acute abdominal pain, abdominal trauma, an obvious or suspected abdominal mass, symptoms of liver disease, pancreatic disease, gallstones, spleen disease, and kidney disease. It can also be used to detect the presence of suspected abnormalities and is often covered by insurance as a ""medically necessary"" procedure. Additionally, ultrasound can be used in treatment and has advantages over x-ray imaging technologies due to its safety and speed.","['radiation. Ultrasound is also generally far better than\nplain x rays at distinguishing the subtle variations of soft\ntissue structures, and can be used in any of several\nmodes, depending on the need at hand.\nAs an imaging tool, abdominal ultrasound generally\nis warranted for patients afflicted with: chronic or acute\nabdominal pain; abdominal trauma; an obvious or sus-\npected abdominal mass; symptoms of liver disease, pan-\ncreatic disease, gallstones , spleen disease, kidney dis-'
 'not well defined in advance, generally take more time\nand are more expensive.\nRegardless of the type of scan used and the potential\ndifficulties encountered, ultrasound remains faster and\nless expensive than computed tomography scans (CT),\nits primary rival in abdominal imaging. Furthermore, as\nabdominal ultrasounds are generally undertaken as\n“medically necessary” procedures designed to detect the\npresence of suspected abnormalities, they are covered\nGALE ENCYCLOPEDIA OF MEDICINE 24'
 'produce a distinctive pattern of echoes. A receiver\n“hears” the returning echo pattern and forwards it to a\ncomputer, which translates the data into an image on a\ntelevision screen. Because ultrasound can distinguish\nsubtle variations between soft, fluid-filled tissues, it is\nparticularly useful in providing diagnostic images of the\nabdomen. Ultrasound can also be used in treatment.\nPurpose\nThe potential medical applications of ultrasound'
 'tion, and interpretation of ultrasound continue. Its low\ncost, versatility, safety and speed have brought it into the\ntop drawer of medical imaging techniques.\nWhile pelvic ultrasound is widely known and com-\nmonly used for fetal monitoring during pregnancy ,\nultrasound is also routinely used for general abdominal\nimaging. It has great advantage over x-ray imaging tech-\nnologies in that it does not damage tissues with ionizing\nradiation. Ultrasound is also generally far better than'
 'initial scan when abdominal trauma is suspected, and it\ncan be used to pinpoint the location, cause, and severity\nof hemorrhaging. In the case of puncture wounds,f r o m\na bullet for example, ultrasound can locate the foreign\nobject and provide a preliminary survey of the damage.\nThe easy portability and versatility of ultrasound tech-\nnology has brought it into common emergency room\nuse, and even into limited ambulance service.\n• Abdominal mass. Abnormal growths—tumors, cysts,']","Abdominal ultrasound is used to evaluate the liver, gallbladder, spleen, pancreas, kidneys, bladder, and other abdominal organs. It can also be used to guide biopsies or drain fluid collections."
What specific conditions are detailed under the section for selecting ultrasound as a treatment option?,"The specific conditions for which ultrasound may be selected as a treatment option include certain types of tumors, lesions, kidney stones and other calculi, muscle and ligament injuries, etc. These conditions are described in detail under the relevant section. The patient's doctor would prescribe medical treatment for these conditions.","['under most types of major medical insurance. As always,\nthough, the patient would be wise to confirm that their\ncoverage extends to the specific procedure proposed. For\nnonemergency situations, most underwriters stipulate\nprior approval as a condition of coverage.\nSpecific conditions for which ultrasound may be\nselected as a treatment option—certain types of tumors,\nlesions, kidney stones and other calculi, muscle and lig-\nament injuries, etc.—are described in detail under the'
 'medical treatment as prescribed by a patient’s doctor is in\norder. See the relevant disease and disorder entries in this\nencyclopedia for more information.\nResources\nBOOKS\nHall, Rebecca. The Ultrasonic Handbook: Clinical, Etiologic\nand Pathologic Implications of Sonographic Findings.\nPhiladelphia: Lippincott, 1993.\nKevles, Bettyann Holtzmann. Naked to the Bone: Medical\nImaging in the Twentieth Century.New Brunswick, NJ:\nRutgers University Press, 1997.'
 'Description\nUltrasound can be done in a doctor’s office or anoth-\ner outpatient setting, such as a hospital or imaging center.\nThe patient removes her clothing from the waist up\nand puts on a hospital gown, open in the front. She lies\non her back or side on an examining table. A gel that\nenhances sound transmission is spread over the area to be\nexamined. The technologist then places a transducer, an\ninstrument about the size of an electric shaver, against'
 'complications result.\nUltrasound technology can also be used for treat-\nment purposes, most frequently as a visual aid during\nsurgical procedures—such as guiding needle placement\nto drain fluid from a cyst, or to extract tumor cells for\nbiopsy. Increasingly, direct therapeutic applications for\nultrasound are being developed.\nThe direct therapeutic value of ultrasonic waves lies\nin their mechanical nature. They are shock waves, just like\naudible sound, and vibrate the materials through which'
 'located and tentatively identified with ultrasound. In\nparticular, potentially malignant solid tumors can be\ndistinguished from benign fluid-filled cysts and\nabscesses. Masses and malformations in any organ or\npart of the abdomen can be found.\n• Liver disease. The types and underlying causes of liver\ndisease are numerous, though jaundice tends to be a\ngeneral symptom. Ultrasound can differentiate between\nmany of the types and causes of liver malfunction, and']","Certain types of tumors, lesions, kidney stones, and other calculi, muscle and ligament injuries."
"What is a common preparation for a patient undergoing an abdominal ultrasound, especially if the gallbladder or ovaries are to be examined?","A patient undergoing an abdominal ultrasound, especially if the gallbladder or ovaries are to be examined, is advised to fast for at least eight hours prior to the procedure. This ensures that the stomach is empty and allows the gall bladder to be seen clearly. A full bladder may also be required in some cases to push intestinal folds out of the way.","['ament injuries, etc.—are described in detail under the\nappropriate entries in this encyclopedia.\nPreparation\nA patient undergoing abdominal ultrasound will be\nadvised by their physician about what to expect and how\nto prepare. As mentioned above, preparations generally\ninclude fasting and arriving for the procedure with a full\nbladder, if necessary. This preparation is particularly use-\nful if the gallbladder, ovaries or veins are to be examined.\nAftercare'
 'ful if the gallbladder, ovaries or veins are to be examined.\nAftercare\nIn general, no aftercare related to the abdominal\nultrasound procedure itself is required.\nRisks\nAbdominal ultrasound carries with it no recognized\nrisks or side effects, if properly performed using appropri-\nate frequency and intensity ranges. Sensitive tissues, par-\nticularly those of the reproductive organs, could possibly\nsustain damage if violently vibrated by overly intense'
 'radiation. Ultrasound is also generally far better than\nplain x rays at distinguishing the subtle variations of soft\ntissue structures, and can be used in any of several\nmodes, depending on the need at hand.\nAs an imaging tool, abdominal ultrasound generally\nis warranted for patients afflicted with: chronic or acute\nabdominal pain; abdominal trauma; an obvious or sus-\npected abdominal mass; symptoms of liver disease, pan-\ncreatic disease, gallstones , spleen disease, kidney dis-'
 'gall bladder to be seen, as it contracts after eating and\nmay not be seen if the stomach is full. In some cases, a\nfull bladder helps to push intestinal folds out of the way\nso that the gas they contain does not disrupt the image.\nThe patient’s abdomen is then greased with a special gel\nthat allows the ultrasound probe to glide easily across the\nskin while transmitting and receiving ultrasonic pulses.\nThis procedure is conducted by a doctor with the'
 'inal aorta and the portal vein of the liver. These\nmachines cost about $250,000.\nThe actual procedure for a patient undergoing an\nabdominal ultrasound is relatively simple, regardless of\nthe type of scan or its purpose. Fasting for at least eight\nhours prior to the procedure ensures that the stomach is\nempty and as small as possible, and that the intestines\nand bowels are relatively inactive. Fasting also allows the\ngall bladder to be seen, as it contracts after eating and']",Fasting and arriving with a full bladder
What type of tissues may be damaged during an abdominal ultrasound procedure due to overly intense frequency and intensity ranges?,"Sensitive tissues, particularly those of the reproductive organs, could possibly sustain damage if violently vibrated by overly intense ultrasound waves. This includes tissues in the gallbladder, ovaries, or veins that may be examined during an abdominal ultrasound procedure. However, this would only result from improper use of the equipment.","['sustain damage if violently vibrated by overly intense\nultrasound waves. In general though, such damage would\nonly result from improper use of the equipment.\nAny woman who thinks she might be pregnant\nshould raise this issue with her doctor before undergoing\nan abdominal ultrasound, as a fetus in the early stages of\ndevelopment could be injured by ultrasound meant to\nprobe deeply recessed abdominal organs.\nNormal results\nAs a diagnostic imaging technique, a normal abdom-'
 'ful if the gallbladder, ovaries or veins are to be examined.\nAftercare\nIn general, no aftercare related to the abdominal\nultrasound procedure itself is required.\nRisks\nAbdominal ultrasound carries with it no recognized\nrisks or side effects, if properly performed using appropri-\nate frequency and intensity ranges. Sensitive tissues, par-\nticularly those of the reproductive organs, could possibly\nsustain damage if violently vibrated by overly intense'
 'Higher frequency ultrasound waves produce more\ndetailed images, but are also more readily absorbed and\nso cannot penetrate as deeply into the body. Abdominal\nultrasound imaging is generally performed at frequencies\nbetween 2-5 MHz.\nAn ultrasound machine consists of two parts: the\ntransducer and the analyzer. The transducer both produces\nthe sound waves that penetrate the body and receives the\nreflected echoes. Transducers are built around piezoelec-'
 'radiation. Ultrasound is also generally far better than\nplain x rays at distinguishing the subtle variations of soft\ntissue structures, and can be used in any of several\nmodes, depending on the need at hand.\nAs an imaging tool, abdominal ultrasound generally\nis warranted for patients afflicted with: chronic or acute\nabdominal pain; abdominal trauma; an obvious or sus-\npected abdominal mass; symptoms of liver disease, pan-\ncreatic disease, gallstones , spleen disease, kidney dis-'
 'audible sound, and vibrate the materials through which\nthey pass. These vibrations are mild, virtually unnotice-\nable at the frequencies and intensities used for imaging.\nProperly focused however, high-intensity ultrasound can\nbe used to heat and physically agitate targeted tissues.\nHigh-intensity ultrasound is used routinely to treat\nsoft tissue injuries, such as strains, tears and associated\nscarring. The heating and agitation are believed to pro-']","The sensitive tissues that may be damaged during an abdominal ultrasound procedure due to overly intense frequency and intensity ranges are those of the reproductive organs, particularly the gallbladder, ovaries, or veins."
What is the specific precaution that should be taken by a woman who thinks she might be pregnant before undergoing an abdominal ultrasound?,"Any woman who thinks she might be pregnant should raise this issue with her doctor before undergoing an abdominal ultrasound, as a fetus in the early stages of development could be injured by ultrasound meant to probe deeply recessed abdominal organs. The technician may insert a plastic probe into the woman's vaginal canal to get a clearer picture of the fetus, especially during early pregnancy. A full bladder is also recommended for certain cases, particularly if the gallbladder or ovaries are to be examined.","['ament injuries, etc.—are described in detail under the\nappropriate entries in this encyclopedia.\nPreparation\nA patient undergoing abdominal ultrasound will be\nadvised by their physician about what to expect and how\nto prepare. As mentioned above, preparations generally\ninclude fasting and arriving for the procedure with a full\nbladder, if necessary. This preparation is particularly use-\nful if the gallbladder, ovaries or veins are to be examined.\nAftercare'
 'ful if the gallbladder, ovaries or veins are to be examined.\nAftercare\nIn general, no aftercare related to the abdominal\nultrasound procedure itself is required.\nRisks\nAbdominal ultrasound carries with it no recognized\nrisks or side effects, if properly performed using appropri-\nate frequency and intensity ranges. Sensitive tissues, par-\nticularly those of the reproductive organs, could possibly\nsustain damage if violently vibrated by overly intense'
 'hibits federal funds including Medicaid funds, from\nbeing used to pay for an elective abortion.\nPreparation\nThe doctor must know accurately the stage of a\nwoman’s pregnancy before an abortion is performed. The\ndoctor will ask the woman questions about her menstrual\ncycle and also do a physical examination to confirm the\nstage of pregnancy. This may be done at an office visit\nbefore the abortion or on the day of the abortion. Some\nstates require a waiting period before an abortion can be'
 'sustain damage if violently vibrated by overly intense\nultrasound waves. In general though, such damage would\nonly result from improper use of the equipment.\nAny woman who thinks she might be pregnant\nshould raise this issue with her doctor before undergoing\nan abdominal ultrasound, as a fetus in the early stages of\ndevelopment could be injured by ultrasound meant to\nprobe deeply recessed abdominal organs.\nNormal results\nAs a diagnostic imaging technique, a normal abdom-'
 'waves better. In certain cases, the technician may insert a\nplastic probe into the woman’s vaginal canal to get a\nclearer picture of the fetus. Early in pregnancy, the test\nmay need to be done with a full bladder.\nUnlike x rays, ultrasound is safe to use during preg-\nnancy. It does not cause any known side-effects that\nwould harm the mother or baby.\nPregnant women usually will have their first ultra-\nsound anytime between 8 and 12 weeks of gestation. In']",The woman should inform her doctor about the possibility of pregnancy before undergoing an abdominal ultrasound to prevent potential damage to the fetus.
What would be a typical reason for performing an abdominal ultrasound scan?,"Abdominal ultrasound scans are typically performed to detect suspected abnormalities in patients with chronic or acute abdominal pain, abdominal trauma, an obvious or suspected abdominal mass, symptoms of liver disease, pancreatic disease, gallstones, spleen disease, kidney disease, and other conditions. They can also be used to locate foreign objects in puncture wounds. The scan is generally considered a safe procedure with no recognized risks or side effects if properly performed.","['not well defined in advance, generally take more time\nand are more expensive.\nRegardless of the type of scan used and the potential\ndifficulties encountered, ultrasound remains faster and\nless expensive than computed tomography scans (CT),\nits primary rival in abdominal imaging. Furthermore, as\nabdominal ultrasounds are generally undertaken as\n“medically necessary” procedures designed to detect the\npresence of suspected abnormalities, they are covered\nGALE ENCYCLOPEDIA OF MEDICINE 24'
 'would rule out this life-threatening condition and point to\nother, less serious causes.\nAbnormal results\nBecause abdominal ultrasound imaging is generally\nundertaken to confirm a suspected condition, the results\nof a scan often will prove abnormal—that is they will\nconfirm the diagnosis, be it kidney stones, cirrhosis of\nthe liver or an aortic aneurysm. At that point, appropriate\nmedical treatment as prescribed by a patient’s doctor is in'
 'radiation. Ultrasound is also generally far better than\nplain x rays at distinguishing the subtle variations of soft\ntissue structures, and can be used in any of several\nmodes, depending on the need at hand.\nAs an imaging tool, abdominal ultrasound generally\nis warranted for patients afflicted with: chronic or acute\nabdominal pain; abdominal trauma; an obvious or sus-\npected abdominal mass; symptoms of liver disease, pan-\ncreatic disease, gallstones , spleen disease, kidney dis-'
 'initial scan when abdominal trauma is suspected, and it\ncan be used to pinpoint the location, cause, and severity\nof hemorrhaging. In the case of puncture wounds,f r o m\na bullet for example, ultrasound can locate the foreign\nobject and provide a preliminary survey of the damage.\nThe easy portability and versatility of ultrasound tech-\nnology has brought it into common emergency room\nuse, and even into limited ambulance service.\n• Abdominal mass. Abnormal growths—tumors, cysts,'
 'ful if the gallbladder, ovaries or veins are to be examined.\nAftercare\nIn general, no aftercare related to the abdominal\nultrasound procedure itself is required.\nRisks\nAbdominal ultrasound carries with it no recognized\nrisks or side effects, if properly performed using appropri-\nate frequency and intensity ranges. Sensitive tissues, par-\nticularly those of the reproductive organs, could possibly\nsustain damage if violently vibrated by overly intense']","To rule out a suspected abdominal aortic aneurysm and identify other possible causes of symptoms such as persistent cough, labored breathing, and upper abdominal pain."
