question,answer,contexts,reference
What is the current understanding of the cause(s) of abdominal wall defects in a fetus?,"The current understanding of the cause(s) of abdominal wall defects in a fetus is unknown. The development of the abdominal wall and its enclosure of internal organs can be imperfect, leading to defects. This can occur due to an improperly developed umbilical opening or other developmental issues.","['abdominal wall.\nCauses and symptoms\nThere are many causes for birth defects that still\nremain unclear. Presently, the cause(s) of abdominal wall\ndefects is unknown, and any symptoms the mother may\nhave to indicate that the defects are present in the fetus\nare nondescript.\nDiagnosis\nAt birth, the problem is obvious, because the base of\nthe umbilical cord at the navel will bulge or, in worse\ncases, contain viscera (internal organs). Before birth, an'
 'Description\nMany unexpected and fascinating events occur dur-\ning the development of a fetus inside the womb. The\nstomach and intestines begin development outside the\nbaby’s abdomen and only later does the abdominal wall\nenclose them. Occasionally, either the umbilical opening\nis too large, or it develops improperly, allowing the bow-\nels or stomach to remain outside or squeeze through the\nabdominal wall.\nCauses and symptoms\nThere are many causes for birth defects that still'
 'Abdominal wall defects\nDefinition\nAbdominal wall defects are birth (congenital)\ndefects that allow the stomach or intestines to protrude.\nGALE ENCYCLOPEDIA OF MEDICINE 2 5\nAbdominal wall defects\nGEM - 0001 to 0432 - A  10/22/03 1:41 PM  Page 5'
 'cases, contain viscera (internal organs). Before birth, an\nultrasound examination may detect the problem. It is\nalways necessary in children with one birth defect to look\nfor others, because birth defects are usually multiple.\nTreatment\nAbdominal wall defects are effectively treated with\nsurgical repair. Unless there are accompanying anom-\nalies, the surgical procedure is not overly complicated.\nThe organs are normal, just misplaced. However, if the'
 'Arlington, V A 22206-1656. (703) 820-7400. <http://www.\nacg.gi.org>.\nAmerican Institute of Ultrasound in Medicine. 14750 Sweitzer\nLane, Suite 100, Laurel, MD 20707-5906. (800) 638-\n5352. <http://www.aium.org>.\nAmerican Society of Radiologic Technologists. 15000 Central\nAve., SE, Albuquerque, NM 87123-3917. (505) 298-4500.\n<http://www.asrt.org>.\nKurt Richard Sternlof\nAbdominal wall defects\nDefinition\nAbdominal wall defects are birth (congenital)']","The current understanding of the cause(s) of abdominal wall defects in a fetus is unknown, and any symptoms the mother may have to indicate that the defects are present in the fetus are nondescript."
A pregnant woman undergoes an ultrasound examination and detects a case of abdominal wall defect in her fetus. What is the recommended next step for this patient?,The recommended next step for this patient is to undergo surgical repair of the abdominal wall defect. This procedure is usually not overly complicated unless there are accompanying anomalies. The surgery aims to correct the misplaced organs by repairing the abdominal wall.,"['cases, contain viscera (internal organs). Before birth, an\nultrasound examination may detect the problem. It is\nalways necessary in children with one birth defect to look\nfor others, because birth defects are usually multiple.\nTreatment\nAbdominal wall defects are effectively treated with\nsurgical repair. Unless there are accompanying anom-\nalies, the surgical procedure is not overly complicated.\nThe organs are normal, just misplaced. However, if the'
 'sustain damage if violently vibrated by overly intense\nultrasound waves. In general though, such damage would\nonly result from improper use of the equipment.\nAny woman who thinks she might be pregnant\nshould raise this issue with her doctor before undergoing\nan abdominal ultrasound, as a fetus in the early stages of\ndevelopment could be injured by ultrasound meant to\nprobe deeply recessed abdominal organs.\nNormal results\nAs a diagnostic imaging technique, a normal abdom-'
 'abdominal wall.\nCauses and symptoms\nThere are many causes for birth defects that still\nremain unclear. Presently, the cause(s) of abdominal wall\ndefects is unknown, and any symptoms the mother may\nhave to indicate that the defects are present in the fetus\nare nondescript.\nDiagnosis\nAt birth, the problem is obvious, because the base of\nthe umbilical cord at the navel will bulge or, in worse\ncases, contain viscera (internal organs). Before birth, an'
 'ament injuries, etc.—are described in detail under the\nappropriate entries in this encyclopedia.\nPreparation\nA patient undergoing abdominal ultrasound will be\nadvised by their physician about what to expect and how\nto prepare. As mentioned above, preparations generally\ninclude fasting and arriving for the procedure with a full\nbladder, if necessary. This preparation is particularly use-\nful if the gallbladder, ovaries or veins are to be examined.\nAftercare'
 'sound anytime between 8 and 12 weeks of gestation. In\nnormal cases, the technician is able to identify a fetal\nheartbeat, which appears as a flashing light on the screen.\nCloser to the due date, physicians use ultrasound to make\nsure the fetus is in the correct position to exit the birth\ncanal head first.\nSometimes an ultrasound will show that a fetus has\nstopped growing, or a gestational sac has formed without\na fetus, and a miscarriage has occurred. Later in pregnan-']",Surgical repair
What is a possible complication of surgically repairing an umbilical hernia if the defect is large?,"If the defect is large, a possible complication of surgically repairing an umbilical hernia is that it may be difficult to fit all the viscera into the small abdominal cavity. This can lead to complications such as excessive bleeding or surgical wound infection. Additionally, there is also a risk of incisional hernia through the surgical scar.","['The organs are normal, just misplaced. However, if the\ndefect is large, it may be difficult to fit all the viscera into\nthe small abdominal cavity.\nPrognosis\nIf there are no other defects, the prognosis after sur-\ngical repair of this condition is relatively good. However,\nKEY TERMS\nHernia—Movement of a structure into a place it\ndoes not belong.\nUmbilical —Referring to the opening in the\nabdominal wall where the blood vessels from the\nplacenta enter.'
 'cases, contain viscera (internal organs). Before birth, an\nultrasound examination may detect the problem. It is\nalways necessary in children with one birth defect to look\nfor others, because birth defects are usually multiple.\nTreatment\nAbdominal wall defects are effectively treated with\nsurgical repair. Unless there are accompanying anom-\nalies, the surgical procedure is not overly complicated.\nThe organs are normal, just misplaced. However, if the'
 'concerns about other complications and emphasized the\nneed for further study of this issue.\nThere are a number of risks common to any surgical\nprocedure such as bleeding, infection, anesthesia reac-\ntion, or unexpected scarring. Hematoma (accumulation\nof blood at the surgical site), or seroma (collection of\nfluid at the surgical site) can delay healing if not drained.\nAny breast reconstruction also poses a risk of asymmetry\nand/or the need for unplanned surgical revision. Persis-'
 'mately eight to 24 hours after surgery. Postoperative\nweight loss follows almost all bowel resections. Weight\nand strength are slowly regained over a period of months.\nRisks\nPotential complications of this abdominal surgery\ninclude:\n• excessive bleeding\n• surgical wound infection\n• incisional hernia (An organ projects through the mus-\ncle wall that surrounds it. The hernia occurs through the\nsurgical scar.)\n• thrombophlebitis (inflammation and blood clot to veins\nin the legs)\n• pneumonia'
 'failure—loss of blood supply to the tissue forming the\nnew breast. If a large portion of the flap develops inade-\nquate blood supply, another reconstructive technique\nmay be necessary. TRAM flap procedures can result in\ndecreased muscle tone and weakness in the abdomen\nand/or abdominal hernia. Arm weakness may occur after\nlatissimus dorsi flap surgery.\nNormal results\nA normal result of breast reconstruction depends on\nthe woman’s goals and expectations. It will not be the']","Strangulation of the intestines due to the large defect making it difficult to fit all the viscera into the small abdominal cavity, which can lead to necrosis and perforation."
"What is the term for a condition where organs are unable to fit inside the abdominal cavity due to excessive size, but the organs themselves are fully functional?","The term for a condition where organs are unable to fit inside the abdominal cavity due to excessive size, but the organs themselves are fully functional is not explicitly mentioned in the provided context. However, it seems to describe a type of hernia or abdominal wall defect where the organs are normal but misplaced. The exact term is not specified, but it appears to be related to an abnormality in the abdominal cavity's ability to accommodate the organs.","['abdominal wall where the blood vessels from the\nplacenta enter.\nViscera—Any of the body’s organs located in the\nchest or abdomen.\n10% of those with more severe or additional abnormali-\nties die from it. The organs themselves are fully function-\nal; the difficulty lies in fitting them inside the abdomen.\nThe condition is, in fact, a hernia requiring only replace-\nment and strengthening of the passageway through\nwhich it occurred. After surgery, increased pressure in'
 'The organs are normal, just misplaced. However, if the\ndefect is large, it may be difficult to fit all the viscera into\nthe small abdominal cavity.\nPrognosis\nIf there are no other defects, the prognosis after sur-\ngical repair of this condition is relatively good. However,\nKEY TERMS\nHernia—Movement of a structure into a place it\ndoes not belong.\nUmbilical —Referring to the opening in the\nabdominal wall where the blood vessels from the\nplacenta enter.'
 'Abdominal wall defects\nDefinition\nAbdominal wall defects are birth (congenital)\ndefects that allow the stomach or intestines to protrude.\nGALE ENCYCLOPEDIA OF MEDICINE 2 5\nAbdominal wall defects\nGEM - 0001 to 0432 - A  10/22/03 1:41 PM  Page 5'
 'many of the types and causes of liver malfunction, and\nis particularly good at identifying obstruction of the\nbile ducts and cirrhosis , which is characterized by\nabnormal fibrous growths and reduced blood flow.\n• Pancreatic disease. Inflammation and malformation of\nthe pancreas are readily identified by ultrasound, as are\npancreatic stones (calculi), which can disrupt proper\nfunctioning.\n• Gallstones. Gallstones cause more hospital admissions\nthan any other digestive malady. These calculi can'
 'Description\nMany unexpected and fascinating events occur dur-\ning the development of a fetus inside the womb. The\nstomach and intestines begin development outside the\nbaby’s abdomen and only later does the abdominal wall\nenclose them. Occasionally, either the umbilical opening\nis too large, or it develops improperly, allowing the bow-\nels or stomach to remain outside or squeeze through the\nabdominal wall.\nCauses and symptoms\nThere are many causes for birth defects that still']",Organomegaly
"What is the primary concern regarding increased pressure in the abdomen after surgery, and how does it affect organ function?","Increased pressure in the abdomen after surgery can compromise the function of organs inside. This is because the stretched abdomen may not be able to accommodate the organs properly. As a result, organ function may be impaired due to the increased pressure.","['which it occurred. After surgery, increased pressure in\nthe stretched abdomen can compromise the function of\nthe organs inside.\nPrevention\nSome, but by no means all, birth defects are pre-\nventable by early and attentive prenatal care, good nutri-\ntion, supplemental vitamins , diligent avoidance of all\nunnecessary drugs and chemicals—especially tobacco—\nand other elements of a healthy lifestyle.\nResources\nPERIODICALS\nDunn, J. C., and E. W. Fonkalsrud. “Improved Survival of'
 'mately eight to 24 hours after surgery. Postoperative\nweight loss follows almost all bowel resections. Weight\nand strength are slowly regained over a period of months.\nRisks\nPotential complications of this abdominal surgery\ninclude:\n• excessive bleeding\n• surgical wound infection\n• incisional hernia (An organ projects through the mus-\ncle wall that surrounds it. The hernia occurs through the\nsurgical scar.)\n• thrombophlebitis (inflammation and blood clot to veins\nin the legs)\n• pneumonia'
 'bladder) may also be inserted to keep the bladder empty\nduring surgery, giving more space in the surgical field\nand decreasing chances of accidental injury.\nAftercare\nPost-operative care for the patient who has had a\nbowel resection, as with those who have had any major\nsurgery, involves monitoring of blood pressure, pulse,\nrespirations, and temperature. Breathing tends to be shal-\nlow because of the effect of anesthesia and the patient’s\nreluctance to breathe deeply and experience pain that is'
 'Abnormal results\nThe doctor should be made aware of any of the fol-\nlowing problems after surgery:\n• increased pain, swelling, redness, drainage, or bleeding\nin the surgical area\n• headache, muscle aches,dizziness,f e v e r\n• increased abdominal pain or swelling,constipation, nau-\nsea or vomiting, rectal bleeding, or black, tarry stools\nResources\nBOOKS\nDoughty, Dorothy. Urinary and Fecal Incontinence.St. Louis:\nMosby-Year Book, Inc., 1991.'
 'abdominal wall where the blood vessels from the\nplacenta enter.\nViscera—Any of the body’s organs located in the\nchest or abdomen.\n10% of those with more severe or additional abnormali-\nties die from it. The organs themselves are fully function-\nal; the difficulty lies in fitting them inside the abdomen.\nThe condition is, in fact, a hernia requiring only replace-\nment and strengthening of the passageway through\nwhich it occurred. After surgery, increased pressure in']","Increased pressure in the abdomen after surgery can compromise the function of organs inside, such as the intestines and liver, leading to potential complications like organ failure or necrosis."
"What is the primary difference between a gastroschisis and an omphalocele as described in the article by Langer, J. C., in Seminars in Pediatric Surgery?",I don't have enough context to answer this question. The provided documents do not mention Langer's article on gastroschisis and omphalocele.,"['Resources\nPERIODICALS\nDunn, J. C., and E. W. Fonkalsrud. “Improved Survival of\nInfants with Omphalocele.”American Journal of Surgery\n173 (April 1997): 284-7.\nLanger, J. C. “Gastroschisis and Omphalocele.”Seminars in\nPediatric Surgery5 (May 1996): 124-8.\nJ. Ricker Polsdorfer, MD\nAbnormal heart rhythms see Arrhythmias\nABO blood typing see Blood typing and\ncrossmatching\nABO incompatibility see Erythroblastosis\nfetalis\nAbortion, habitual see Recurrent\nmiscarriage\nAbortion, partial birth\nDefinition'
 'secretion. The most common hypersecretory syn-\ndrome of the stomach is Zollinger-Ellison Syn-\ndrome, a syndrome consisting of fulminating\nintractable peptic ulcers, gastric hypersecretion and\nhyperacidity, and the occurrence of gastrinomas of\nthe pancreatic cells of the islets of Langerhans.\nInflammation —Pain, redness, swelling, and heat\nthat usually develop in response to injury or ill-\nness.\nMucous—Thick fluid produced by the moist mem-\nbranes that line many body cavities and structures.'
 'Colitis —An inflammation of the large intestine\nthat occurs in some cases of balantidiasis. It is\nmarked by cramping pain and the passing of\nbloody mucus.\nProtozoan—A single-celled, usually microscopic\norganism, such as B. coli, that is eukaryotic and,\ntherefore, different from bacteria (prokaryotic).\nSigmoidoscopy —A procedure in which a thin,\nflexible, lighted instrument, called a sigmoido-\nscope, is used to visually examine the lower part\nof the large intestine.\nPurpose'
 'Rahway, NJ: Merck Research Laboratories, 1992.\nWeinberg, Adriana, and Myron J. Levin. “Infections: Parasitic\n& Mycotic.” In Current Pediatric Diagnosis & Treatment,\ned. William W. Hay Jr., et al. Stamford: Appleton &\nLange, 1997.\nRebecca J. Frey\nAmebic dysentery see Amebiasis\nAmenorrhea\nDefinition\nThe absence of menstrual periods is called amenor-\nrhea. Primary amenorrhea is the failure to start having a\nperiod by the age of 16. Secondary amenorrhea is more'
 'cines. When this happens, the effects of one or both of\nthe drugs may change or the risk of side effects may be\ngreater. Anyone who takes antiprotozoal drugs should let\nKEY TERMS\nAmebiasis —An infection caused by an ameba,\nwhich is a type of protozoan.\nFetus—A developing baby inside the womb.\nGiardiasis —A condition in which the intestines\nare infected with Giardia lamblia, a type of proto-\nzoan.\nInflammation —Pain, redness, swelling, and heat']","Gastroschisis and omphalocele are two distinct congenital anomalies of the anterior abdominal wall. The primary difference between them is that gastroschisis is a defect in the posterior wall of the umbilical cord, allowing intestinal contents to protrude through it, whereas omphalocele is a hernia-like protrusion of the intestines into the base of the umbilicus, which is covered by a sac of peritoneal membrane. In gastroschisis, there is no covering sac present, and the defect is usually located on the right side of the abdomen, whereas in omphalocele, a sac is present that covers the herniated contents."
